{
  "batch_id": "batch-l2-review2-redesign-planning-exec-w2",
  "dispatch_id": "l2-review2-redesign-planning",
  "wave_ref": "w2",
  "batch_created_at": "2026-06-09T06:00:00Z",
  "execution_mode": "agent_exec",
  "task_results": [
    {
      "task_id": "t3",
      "track_ref": "t3",
      "exec_status": "completed",
      "not_run_reason": null,
      "deliverables_produced": [
        {
          "path": "plans/gd/2026-06-08-l2-review2-redesign/packets/t3-plan-mode-template.md",
          "kind": "file",
          "verified": true
        }
      ],
      "verify_results": [
        {
          "sc_ref": "SC-3",
          "method": "command",
          "cmd": "test -f templates/plan-mode-template.md && echo PASS",
          "result": "PASS",
          "exit_code": 0
        }
      ],
      "gd_execution_status_json": {
        "task_id": "t3",
        "exec_status": "completed",
        "sc_results": {
          "SC-3": "pass"
        }
      }
    },
    {
      "task_id": "t4",
      "track_ref": "t4",
      "exec_status": "completed",
      "not_run_reason": null,
      "deliverables_produced": [
        {
          "path": "plans/gd/2026-06-08-l2-review2-redesign/packets/t4-antifill-hard-gate.md",
          "kind": "file",
          "verified": true
        }
      ],
      "verify_results": [
        {
          "sc_ref": "SC-4",
          "method": "command",
          "cmd": "grep -q PLAN_ANTIFILL_FAIL scripts/gd-validate-review2-plan-target.py && echo PASS",
          "result": "PASS",
          "exit_code": 0
        }
      ],
      "gd_execution_status_json": {
        "task_id": "t4",
        "exec_status": "completed",
        "sc_results": {
          "SC-4": "pass"
        }
      }
    }
  ]
}