{
  "batch_id": "batch-fix-review-chain-bugs-20260616-wave3",
  "dispatch_id": "fix-review-chain-bugs-20260616",
  "wave_ref": "w3",
  "batch_created_at": "2026-06-16T09:09:17Z",
  "execution_mode": "agent_exec",
  "task_results": [
    {
      "task_id": "step-5-l2-cleanup",
      "track_ref": "step-5-l2-cleanup",
      "exec_status": "completed",
      "not_run_reason": null,
      "deliverables_produced": [
        {"path": "scripts/gd-validate-review2-output.py", "kind": "file", "verified": true},
        {"path": "scripts/gd-audit-legacy-review-trust.py", "kind": "file", "verified": true},
        {"path": "tests/gd-step5-l2-cleanup-smoke.sh", "kind": "file", "verified": true}
      ],
      "verify_results": [
        {"sc_ref": "SC-11", "method": "command", "cmd": "bash tests/gd-step5-l2-cleanup-smoke.sh 8/8 PASS：空 MANDATORY_READ 跑 gd-validate-review2-output.py 断言 exit 1 + COVERAGE_VALIDATE_FAIL(fail-closed)；JSON 格式 raw_result_path 跑 gd-audit-legacy-review-trust.py 断言归类 trusted_codex_raw", "result": "PASS", "exit_code": 0}
      ],
      "gd_execution_status_json": {
        "task_id": "step-5-l2-cleanup",
        "exec_status": "completed",
        "sc_results": {"SC-11": "pass"}
      }
    }
  ]
}
