{
  "batch_id": "batch-l2-review2-redesign-planning-exec-w1",
  "dispatch_id": "l2-review2-redesign-planning",
  "wave_ref": "w1",
  "batch_created_at": "2026-06-09T06:00:00Z",
  "execution_mode": "agent_exec",
  "task_results": [
    {
      "task_id": "t1",
      "track_ref": "t1",
      "exec_status": "completed",
      "not_run_reason": null,
      "deliverables_produced": [
        {
          "path": "plans/gd/2026-06-08-l2-review2-redesign/packets/t1-exhaustive-and-dual-codex.md",
          "kind": "file",
          "verified": true
        }
      ],
      "verify_results": [
        {
          "sc_ref": "SC-1",
          "method": "command",
          "cmd": "grep -q REVIEW_LENS_EMPHASIS scripts/gd-codex-bridge-review.py && echo PASS",
          "result": "PASS",
          "exit_code": 0
        }
      ],
      "gd_execution_status_json": {
        "task_id": "t1",
        "exec_status": "completed",
        "sc_results": {
          "SC-1": "pass"
        }
      }
    },
    {
      "task_id": "t2",
      "track_ref": "t2",
      "exec_status": "completed",
      "not_run_reason": null,
      "deliverables_produced": [
        {
          "path": "plans/gd/2026-06-08-l2-review2-redesign/packets/t2-dryrun-gate.md",
          "kind": "file",
          "verified": true
        }
      ],
      "verify_results": [
        {
          "sc_ref": "SC-2",
          "method": "command",
          "cmd": "test -x scripts/gd-review2-preflight.sh && echo PASS",
          "result": "PASS",
          "exit_code": 0
        }
      ],
      "gd_execution_status_json": {
        "task_id": "t2",
        "exec_status": "completed",
        "sc_results": {
          "SC-2": "pass"
        }
      }
    }
  ]
}