{
  "batch_id": "batch-fix-review-chain-bugs-20260616-wave1",
  "dispatch_id": "fix-review-chain-bugs-20260616",
  "wave_ref": "w1",
  "batch_created_at": "2026-06-16T09:09:17Z",
  "execution_mode": "agent_exec",
  "task_results": [
    {
      "task_id": "step-1-shared-p0-failclosed",
      "track_ref": "step-1-shared-p0-failclosed",
      "exec_status": "completed",
      "not_run_reason": null,
      "deliverables_produced": [
        {"path": "scripts/gd-codex-bridge-review.py", "kind": "file", "verified": true},
        {"path": "scripts/gd-validate-review-content-evidence.py", "kind": "file", "verified": true},
        {"path": "scripts/gd-validate-execution-outcome.py", "kind": "file", "verified": true},
        {"path": "tests/gd-step1-shared-p0-smoke.sh", "kind": "file", "verified": true}
      ],
      "verify_results": [
        {"sc_ref": "SC-1", "method": "command", "cmd": "grep -nE 'return 0 if .*APPROVED.*else.*0' scripts/gd-codex-bridge-review.py 无命中；RC parse-transport exit 1", "result": "PASS", "exit_code": 0},
        {"sc_ref": "SC-2", "method": "command", "cmd": "UNKNOWN verdict review 跑 gd-validate-review-content-evidence.py 断言 exit 1 + FAKE_EVIDENCE_DETECTED", "result": "PASS", "exit_code": 0},
        {"sc_ref": "SC-3", "method": "command", "cmd": "RC 无 ### Finding 文本 exit≠0；.json + --skip-line-ref-check 拒绝 exit 1", "result": "PASS", "exit_code": 0},
        {"sc_ref": "SC-4", "method": "command", "cmd": "build_gate+not_run outcome 跑 gd-validate-execution-outcome.py 复跑/报应改pass；schema 瑕疵 PHASE2_SKIPPED；重复 sc_ref 保留首条", "result": "PASS", "exit_code": 0},
        {"sc_ref": "SC-12", "method": "command", "cmd": "引用风格各异但合法的审查正例 fixture 跑 content-evidence 断言 exit 0、verdict 保留、仅该条降级", "result": "PASS", "exit_code": 0},
        {"sc_ref": "SC-13", "method": "command", "cmd": "writer 输出 REQUIRES_CHANGES 跑 bridge parse 断言映射 REQUIRES_CHANGES 非 failed_to_run", "result": "PASS", "exit_code": 0}
      ],
      "gd_execution_status_json": {
        "task_id": "step-1-shared-p0-failclosed",
        "exec_status": "completed",
        "sc_results": {"SC-1": "pass", "SC-2": "pass", "SC-3": "pass", "SC-4": "pass", "SC-12": "pass", "SC-13": "pass"}
      }
    },
    {
      "task_id": "step-3-l3-validators",
      "track_ref": "step-3-l3-validators",
      "exec_status": "completed",
      "not_run_reason": null,
      "deliverables_produced": [
        {"path": "scripts/gd-validate-runtime-strict-binding.py", "kind": "file", "verified": true},
        {"path": "scripts/gd-validate-stage-dispatch-ledger.py", "kind": "file", "verified": true},
        {"path": "scripts/gd-validate-parent-close-gate.py", "kind": "file", "verified": true},
        {"path": "scripts/gd-validate-codex-cross-review-aggregate.py", "kind": "file", "verified": true},
        {"path": "scripts/gd-validate-codex-cross-review-manifest.py", "kind": "file", "verified": true},
        {"path": "scripts/gd-validate-execution-batch.py", "kind": "file", "verified": true},
        {"path": "scripts/gd-validate-master-plan-consistency.py", "kind": "file", "verified": true},
        {"path": "scripts/gd-validate-controller-report.py", "kind": "file", "verified": true},
        {"path": "scripts/gd-validate-dispatch.py", "kind": "file", "verified": true},
        {"path": "scripts/gd-validate-child-proposal.py", "kind": "file", "verified": true},
        {"path": "scripts/gd-validate-subplan-codex-binding.py", "kind": "file", "verified": true},
        {"path": "scripts/gd-validate-runtime-evidence.py", "kind": "file", "verified": true},
        {"path": "tests/gd-validator-hardening-smoke.sh", "kind": "file", "verified": true}
      ],
      "verify_results": [
        {"sc_ref": "SC-8", "method": "command", "cmd": "bash tests/gd-validator-hardening-smoke.sh：6 验证器正负 fixture(空壳anchor/假hash/字符串true/空jobs/缺jsonschema) PASSES=20 FAILS=0", "result": "PASS", "exit_code": 0}
      ],
      "gd_execution_status_json": {
        "task_id": "step-3-l3-validators",
        "exec_status": "completed",
        "sc_results": {"SC-8": "pass"}
      }
    }
  ]
}
