{
  "batch_id": "batch-l2-review2-redesign-planning-exec-w5",
  "dispatch_id": "l2-review2-redesign-planning",
  "wave_ref": "w5",
  "batch_created_at": "2026-06-09T06:00:00Z",
  "execution_mode": "agent_exec",
  "task_results": [
    {
      "task_id": "t9",
      "track_ref": "t9",
      "exec_status": "completed",
      "not_run_reason": null,
      "deliverables_produced": [
        {
          "path": "plans/gd/2026-06-08-l2-review2-redesign/packets/t9-deploy-live.md",
          "kind": "file",
          "verified": true
        }
      ],
      "verify_results": [
        {
          "sc_ref": "SC-9",
          "method": "command",
          "cmd": "python3 -c \"import json;[json.loads(l) for l in open('.deploy-manifest.jsonl') if l.strip() and not l.startswith('#')]\" && echo PASS",
          "result": "PASS",
          "exit_code": 0
        }
      ],
      "gd_execution_status_json": {
        "task_id": "t9",
        "exec_status": "completed",
        "sc_results": {
          "SC-9": "pass"
        }
      }
    }
  ]
}