{
  "batch_id": "batch-l2-review2-redesign-planning-exec-w4",
  "dispatch_id": "l2-review2-redesign-planning",
  "wave_ref": "w4",
  "batch_created_at": "2026-06-09T06:00:00Z",
  "execution_mode": "agent_exec",
  "task_results": [
    {
      "task_id": "t7",
      "track_ref": "t7",
      "exec_status": "completed",
      "not_run_reason": null,
      "deliverables_produced": [
        {
          "path": "plans/gd/2026-06-08-l2-review2-redesign/packets/t7-controller-baseline-convergence.md",
          "kind": "file",
          "verified": true
        }
      ],
      "verify_results": [
        {
          "sc_ref": "SC-7",
          "method": "command",
          "cmd": "test -f scripts/gd-review-controller.py && echo PASS",
          "result": "PASS",
          "exit_code": 0
        }
      ],
      "gd_execution_status_json": {
        "task_id": "t7",
        "exec_status": "completed",
        "sc_results": {
          "SC-7": "pass"
        }
      }
    },
    {
      "task_id": "t8",
      "track_ref": "t8",
      "exec_status": "completed",
      "not_run_reason": null,
      "deliverables_produced": [
        {
          "path": "plans/gd/2026-06-08-l2-review2-redesign/packets/t8-deliverable-packaging.md",
          "kind": "file",
          "verified": true
        }
      ],
      "verify_results": [
        {
          "sc_ref": "SC-8",
          "method": "command",
          "cmd": "test -x scripts/gd-review2-package-deliverable.sh && echo PASS",
          "result": "PASS",
          "exit_code": 0
        }
      ],
      "gd_execution_status_json": {
        "task_id": "t8",
        "exec_status": "completed",
        "sc_results": {
          "SC-8": "pass"
        }
      }
    }
  ]
}