{
  "batch_id": "batch-l2-review2-redesign-planning-exec-w3",
  "dispatch_id": "l2-review2-redesign-planning",
  "wave_ref": "w3",
  "batch_created_at": "2026-06-09T06:00:00Z",
  "execution_mode": "agent_exec",
  "task_results": [
    {
      "task_id": "t5",
      "track_ref": "t5",
      "exec_status": "completed",
      "not_run_reason": null,
      "deliverables_produced": [
        {
          "path": "plans/gd/2026-06-08-l2-review2-redesign/packets/t5-split-commands-triage.md",
          "kind": "file",
          "verified": true
        }
      ],
      "verify_results": [
        {
          "sc_ref": "SC-5",
          "method": "command",
          "cmd": "test -f scripts/gd-detect-review2-code-target.py && echo PASS",
          "result": "PASS",
          "exit_code": 0
        }
      ],
      "gd_execution_status_json": {
        "task_id": "t5",
        "exec_status": "completed",
        "sc_results": {
          "SC-5": "pass"
        }
      }
    },
    {
      "task_id": "t6",
      "track_ref": "t6",
      "exec_status": "completed",
      "not_run_reason": null,
      "deliverables_produced": [
        {
          "path": "plans/gd/2026-06-08-l2-review2-redesign/packets/t6-fix-bridge-target.md",
          "kind": "file",
          "verified": true
        }
      ],
      "verify_results": [
        {
          "sc_ref": "SC-6",
          "method": "command",
          "cmd": "test -f reports/t6-router-target-trace.md && echo PASS",
          "result": "PASS",
          "exit_code": 0
        }
      ],
      "gd_execution_status_json": {
        "task_id": "t6",
        "exec_status": "completed",
        "sc_results": {
          "SC-6": "pass"
        }
      }
    }
  ]
}