{
  "batch_id": "batch-agent-exec-fixture-wave1",
  "dispatch_id": "agent-exec-fixture",
  "wave_ref": "w1",
  "batch_created_at": "2026-05-11T00:00:00Z",
  "execution_mode": "agent_exec",
  "task_results": [
    {
      "task_id": "t-h3-command",
      "track_ref": "t-h3-command",
      "exec_status": "completed",
      "not_run_reason": null,
      "deliverables_produced": [
        {
          "path": "fixtures/agent-exec/valid-agent-exec-batch.json",
          "kind": "file",
          "verified": true
        }
      ],
      "verify_results": [
        {
          "sc_ref": "SC-1",
          "method": "command",
          "cmd": "test -f fixtures/agent-exec/valid-agent-exec-batch.json",
          "result": "PASS",
          "exit_code": 0
        }
      ],
      "gd_execution_status_json": {
        "task_id": "t-h3-command",
        "exec_status": "completed",
        "sc_results": {
          "SC-1": "pass"
        }
      }
    }
  ]
}
